,propertyCode,thumbnail,externalReference,numPhotos,floor,price,propertyType,operation,size,exterior,rooms,bathrooms,address,province,municipality,district,country,latitude,longitude,showAddress,url,distance,description,hasVideo,status,newDevelopment,hasLift,priceByArea,hasPlan,has3DTour,has360,hasStaging,superTopHighlight,topNewDevelopment,detailedType.typology,suggestedTexts.subtitle,suggestedTexts.title,labels,detailedType.subTypology,neighborhood,parkingSpace.hasParkingSpace,parkingSpace.isParkingSpaceIncludedInPrice,parkingSpace.parkingSpacePrice,newDevelopmentFinished
24,98638822,https://img3.idealista.com/blur/WEB_LISTING/0/id.pro.es.image.master/69/22/fa/1018881861.jpg,5397D,19,1,180000.0,flat,sale,55.0,True,1,1,Calle Orzán,A Coruña,A Coruña,Ensanche - Juan Florez,es,43.3686376,-8.4040197,False,https://www.idealista.com/inmueble/98638822/,1060,"OPORTUNIDAD! APARTAMENTO DE DISEÑO - TOTALMENTE REFORMADO A ESTRENAR - REF: 5397 Rias Altas en Calle Orzán. A un paso de la Plaza de Pontevedra y pegado a las playas, te presentamos este apartamento prácticamente a estrenar y amueblado. Se trata de un apartamento de diseño, que consta de salón comedor, cocina independiente integrada con todos los electrodomésticos, un dormitorio doble y un baño completo de tres piezas con plato de ducha en pasillo. La zona de comedor es fácilmente convertible en otro dormitorio.   Dotado con muy buenos materiales, suelos de tarima y mosaico, agua caliente por termo eléctrico, ventanas de climalit.. . Excelente tanto para inversión como para primera vivienda. No te lo pierdas y llámanos para visitar...",True,good,False,False,3273.0,True,False,False,False,False,False,flat,"Ensanche, A Coruña",Piso en Calle Orzán,"[{'name': 'apartamentoType', 'text': 'Apartamento'}]",,Ensanche,,,,
25,98564090,https://img3.idealista.com/blur/WEB_LISTING/0/id.pro.es.image.master/85/c0/b1/1016523911.jpg,,23,3,165000.0,flat,sale,111.0,True,3,2,Calle Noia,A Coruña,A Coruña,Os Mallos,es,43.3573856,-8.4108487,False,https://www.idealista.com/inmueble/98564090/,2428,"TechFlip te presenta este maravilloso inmueble exterior, con ascensor, garaje y recién rehabilitado, perfecto para tu nueva etapa de vida.  La vivienda posee todo lo necesario para sentirse cómodo en todo momento: una amplia cocina reformada con balcón, un garaje privado con acceso directo al edificio, dos cuartos de baño rehabilitados, un dormitorio principal independiente al resto de habitaciones, una comunidad de propietarios amable, etc. Esta maravillosa vivienda de 95m2 comienza con un precioso recibidor con armarios empotrados. A continuación podemos encontrar dos habitaciones dobles y el salón. Caminando por el pasillo vemos ambos baños.  Al final de este, se encuentra una amplia cocina reformada, con un bonito balcón (en el cual podrás colgar la ropa aunque llueva). Por último, nos podemos ver el dormitorio principal. Con 15m2, cuenta con armarios empotrados y un amplio abanico de posibilidades de distribución. Hay numerosos restaurantes, tiendas y servicios en las calles cercanas. Dispone de una excelente comunicación para entrar y salir de la ciudad. A ello hay que sumar que esta situado al lado de la Estación de Trenes de A Coruña (la cual se fusionará con la estación de autobuses: proyecto de la intermodal). El transporte público es amlio y sencillo, con un gran número de líneas a menos de 5 minutos de su puerta. Buses universiarios, al centro de la ciudad, Marineda City, etc. Todos estos factores hacen que sea una gran oportunidad para vivir e invertir, ya que componen un excelente escenario para la revalorización de la vivienda en los próximos años.  Solicita una visita, ¡estaremos encantados de poder ayudarte! TechFlip.",True,good,False,True,1486.0,True,False,False,False,False,False,flat,"Os Mallos, A Coruña",Piso en Calle Noia,,,,True,True,,
26,97423816,https://img3.idealista.com/blur/WEB_LISTING/0/id.pro.es.image.master/3d/f5/dc/979009355.jpg,3421-07639,18,1,135000.0,flat,sale,83.0,False,3,1,Alcalde Lens,A Coruña,A Coruña,Agra del Orzán - Ventorrillo,es,43.3624587,-8.4203509,False,https://www.idealista.com/inmueble/97423816/,2415,"Recién reformado en la calle Acalde Lens, próximo a la Av de Finisterre y Ronda de Nelle. 83 m2, 3 dormitorios, 1 cuarto de baño, salón y cocina con salida a patio. La vivienda ha sido reformada integralmente hace pocos años, está prácticamente nueva. Se ha renovado la instalación eléctrica con tomas de televisión en todas la habitaciones, iluminación led empotrada en toda la casa, Hilo musical, ventanas de climalit oscilobatientes. Cocina con un bonito diseño, totalmente amueblada con todos los electromésticos nuevos y mucho almacenaje. Tiene salida a un amplio patio de uso exclusivo de ésta vivienda. Todas las estancias de la vivienda se distribuyen alrededor de un amplio patio, con amplios ventanales que le aportan mucha luz a todas las habitaciones. Los 3 dormitorios son de buen tamaño sobre todo el principal que cuenta con espacio apropiado para zona de vestidor. También cuenta con un buen cuarto de baño con amplia ducha y muebles con gran capacidad. NOTA; Este anuncio no es vinculante, puede contener errores, se muestra a título informativo, no contractual.",False,good,False,True,1627.0,False,False,False,False,False,False,flat,"Agra del Orzán - Ventorrillo, A Coruña",Piso en Alcalde Lens,,,,,,,
27,96066658,https://img3.idealista.com/blur/WEB_LISTING/0/id.pro.es.image.master/13/88/b4/935843911.jpg,3421-07179,13,1,63000.0,flat,sale,70.0,True,3,1,SAGRADA FAMILIA,A Coruña,A Coruña,Sagrada Familia,es,43.3591078,-8.4170992,False,https://www.idealista.com/inmueble/96066658/,2519,"Ofrecemos esta vivienda para reformar ubicada en la sagrada familia, si quiere hacer una inversión y transformar este piso a tu gusto nuestro departamento técnico te ayudara. La vivienda consta de tres dormitorios uno de ellos es habitación Italiana, un salón, cocina, baño, la  cocina dispone de un patio amplio y el salón de una terraza, es una primera planta SIN ASCENSOR. Como se puede apreciar en las fotos la vivienda es para reformarla entera, adaptarla a las nuevas tendencias. A través de convenios nacionales con las principales entidades bancarias nuestros cliente pueden disponer de las mejores condiciones especiales y ventajosas recibiendo un trato prime que nos diferencia  Este anuncio no es vinculante, puede contener errores, se muestra a titulo informativo y no contractual.",False,renew,False,False,900.0,False,False,False,False,False,False,flat,"Sagrada Familia, A Coruña",Piso en SAGRADA FAMILIA,,,,,,,
28,96815687,https://img3.idealista.com/blur/WEB_LISTING/0/id.pro.es.image.master/38/d3/9b/957307963.jpg,OC-2058,35,5,78000.0,flat,sale,83.0,True,3,1,Antonio Rios,A Coruña,A Coruña,Los Castros - Castrillón,es,43.3518226,-8.3930795,False,https://www.idealista.com/inmueble/96815687/,2866,"¡Oportunidad! 78.000 € precio de venta solamente para compra directa en los próximos 10 días.  89.000 € si no es así. Piso completamente reformado. y listo para entrar a vivir Tiene una amplia y cómoda cocina con mucha luz, amueblada y con todos los electrodomésticos. Todas las habitaciones son exteriores y muy luminosas. Dispone de dos habitaciones amplias y una más pequeña con armario empotrado que actualmente se utiliza como sala de estar, pero que se puede usar como dormitorio o estudio. El baño se ha renovado completamente y cuenta con una ducha muy amplia. La carpintería exterior es de aluminio con cristales dobles Climalit.  A mayores, el piso cuenta con un trastero, que es todo el bajo cubierta del piso. El edificio no tiene ascensor.",False,good,False,False,940.0,True,False,False,False,False,False,flat,"Los Castros - Castrillón, A Coruña",Piso en Antonio Rios,,,,,,,
29,98793839,https://img3.idealista.com/blur/WEB_LISTING/0/id.pro.es.image.master/78/51/d5/1037228803.jpg,385866,20,bj,85000.0,flat,sale,105.0,True,2,2,Calle Simón Bolívar,A Coruña,A Coruña,Riazor - Los Rosales,es,43.3748902,-8.4341479,False,https://www.idealista.com/inmueble/98793839/,2891,"Se vende un bajo actualmente en esta bruto, en obra, situado en Los Rosales con parte superior, es una oportunidad para convertir en una amplia vivienda con dos dormitorios, amplio salón con cocina y 2 baños. Parte inferior distribuida en salón con cocina, dormitorio y baño  Y además una amplia habitación con baño en la zona superior Proyecto presentado y aprobado para cambio de uso Se muestra una pequeña infografía de como quedaría el piso.",False,good,False,False,810.0,True,False,False,False,False,False,flat,"Riazor - Los Rosales, A Coruña",Piso en Calle Simón Bolívar,,,,,,,
30,98509549,https://img3.idealista.com/blur/WEB_LISTING/0/id.pro.es.image.master/5a/09/7a/1014771967.jpg,,4,bj,145000.0,flat,sale,133.0,True,2,2,Calle San Vicente s/n,A Coruña,A Coruña,Os Mallos,es,43.3545329,-8.411547,True,https://www.idealista.com/inmueble/98509549/,2741,"OPORTUNIDAD DE COMPRA DE LOCAL, CON PROYECTO DE EJECUCION DE CAMBIO DE USO A VIVIENDA Y LICENCIA MUNICIPAL. Es una buena oportunidad pues, la obra esta empezada, si se compra ahora es un precio muy distinto del que será con la obra finalizada.  Tiene licencia de vivienda y proyecto de cambio de uso. Instalación de suelo radiante y techos altos. Tiene dos baños y zona de lavandería. Dos dormitorios. Salón, con cocina estudio. Son 133 metros cuadrados de construcción con patio y Zaguán. Si lo desea, llámenos y se lo enseñamos encantados. Este anuncio no es vinculante, puede contener errores. Se muestra a titulo informativo y no contractual.",False,renew,False,False,1090.0,True,False,False,False,False,False,flat,"Os Mallos, A Coruña",Piso en Calle San Vicente s/n,,,,,,,
31,98840424,https://img3.idealista.com/blur/WEB_LISTING/0/id.pro.es.image.master/26/53/d7/1025546305.jpg,,30,1,178000.0,flat,sale,50.0,True,1,1,Calle Miguel Servet s/n,A Coruña,A Coruña,Monte Alto - Zalaeta - Atocha,es,43.3760742,-8.3972154,True,https://www.idealista.com/inmueble/98840424/,172,"BONITO PISO EN VENTA, EN UNO DE LOS BARRIOS MÁS DEMANDADOS DE LA CIUDAD. La situación de la vivienda, lo hace idóneo para inversionistas, pues está muy cerca de La Escuela de Arte Superior de Diseño Pablo Picasso y de La Policía Local, por lo que la zona es muy demandada por estudiantes. La vivienda, es muy bonita y acogedora, no tiene pasillo por lo que no se pierde espacio ninguno. El piso tiene mucha claridad. Es pequeño, pero muy acogedor. La zona es privilegiada, pues está muy cerca del Ayuntamiento, de la Plaza de España, Paseo Marítimo, Playas, cerca del Club del Mar, con sus instalaciones de piscinas, gimnasio, duchas, etc. Es uno de los barrios con más vida de la ciudad, tiene de todo, muy cerca de la vivienda, hay un gran supermercado, colegios, parques, centro de salud, farmacias, paradas de buses, taxis, cafeterías, restaurantes, y un parque muy próximo, donde se juega a la petanca, etc. En la actualidad esta alquilado, le quedan unos meses a la inquilina. No lo dude, llamenos y se lo enseñamos con mucho gusto. Este anuncio, no es vinculante, puede contener errores. Se muestra a titulo informativo y no contractual.",False,good,False,True,3560.0,False,False,False,False,False,False,flat,"Monte Alto - Zalaeta - Atocha, A Coruña",Piso en Calle Miguel Servet s/n,,,,,,,
32,96487874,https://img3.idealista.com/blur/WEB_LISTING/0/id.pro.es.image.master/98/6b/cc/948673703.jpg,,23,1,174000.0,flat,sale,80.0,True,2,1,"francisco añon, 2",A Coruña,A Coruña,Agra del Orzán - Ventorrillo,es,43.3625962,-8.4177584,True,https://www.idealista.com/inmueble/96487874/,2256,"apartamento muy amplio y soleado que consta de 2 dormitorios, salon, cocina y cuarto de baño se daria completamente reformado, primeras calidades y con el mejor diseño.",False,good,False,True,2175.0,True,False,False,False,False,False,flat,"Agra del Orzán - Ventorrillo, A Coruña","Piso en francisco añon, 2",,,,,,,
33,99211726,https://img3.idealista.com/blur/WEB_LISTING/0/id.pro.es.image.master/97/b3/ee/1036802050.jpg,05183,16,3,100000.0,flat,sale,90.0,True,3,1,barrio Falperra-Santa Lucía,A Coruña,A Coruña,Ensanche - Juan Florez,es,43.3575444,-8.409606,False,https://www.idealista.com/inmueble/99211726/,2372,"Vivienda de 78m2 construidos, situada en la zona de la Falperra. Tres dormitorios, un baño, salón, cocina, calefacción eléctrica. Es exterior. Edificio sin ascensor. * Fotos no actuales.",False,good,False,False,1111.0,False,False,False,False,False,False,flat,"Falperra-Santa Lucía, A Coruña",Piso,,,Falperra-Santa Lucía,,,,
34,96835545,https://img3.idealista.com/blur/WEB_LISTING/0/id.pro.es.image.master/d5/eb/52/961758696.jpg,,21,5,125000.0,flat,sale,81.0,True,3,1,"Calle Tettamancy, 1",A Coruña,A Coruña,Os Mallos,es,43.3535673,-8.4125027,True,https://www.idealista.com/inmueble/96835545/,2870,"Esta vivienda totalmente reformada está ubicada en la zona de los Mallos. Cuenta con una amplia variedad de servicios cercanos: supermercados, parques, ambulatorio, pabellón deportivo. cerca de la ronda de Outeiro con un parquin publico para alquiler de plaza en caso de necesidad. La primera zona de la vivienda cuenta con una imponente entrada que nos lleva a un salón con vistas a la calle. Por otro lado, en la segunda zona se encuentra la cocina equipada con todos los electrodomésticos horno cocina, nevera, y lavadora con vistas a un patio. Tiene una orientación con mucha luz. La vivienda consta de un cuarto de baño completo y tres habitaciones. Dos de las habitaciones cuenta con vistas a la calle y las otra da hacia patios interiores. Es una magnífica vivienda distribuida que aprovecha totalmente los espacios y permite vivir en una de las mejores zonas de la ciudad. En House By Click queremos que tu vivienda sea tu mejor hogar.  No dudes en ponerte en contacto con nosotros para solicitar más información sobre el inmueble. Te resolveremos cualquier duda. ¡Contáctanos, estaremos encantados de asesorarte! Este anuncio no es vinculante, puede contener errores. Se muestra a titulo informativo y no contractual.",False,good,False,False,1543.0,False,False,False,False,False,False,flat,"Os Mallos, A Coruña","Piso en Calle Tettamancy, 1",,,,,,,
35,95369601,https://img3.idealista.com/blur/WEB_LISTING/0/id.pro.es.image.master/5a/f0/cb/916550488.jpg,21-053,6,,198000.0,chalet,sale,76.0,False,2,1,"Doctor Ferrant, 15",A Coruña,A Coruña,Monte Alto - Zalaeta - Atocha,es,43.3784313,-8.4026713,True,https://www.idealista.com/inmueble/95369601/,358,"Casa adosada en venta en Monte Alto, concretamente en la Calle Doctor Ferrant.  El solar ocupa una superficie de 131m², de los cuales 76m² corresponden a la vivienda, 19 m² de almacen y el restante se corresponde con la terraza/jardín de la parte posterior de la vivienda.  La vivienda se distribuye de la siguiente manera dos habitaciones, una cocina independiente desde la cual se accede al jardín/terraza, un salón y un baño.  El estado de la casa es para reformar a gusto del comprador. Vivienda en una zona muy bien comunicada y con todos los servicios a un paso (farmacias, colegios, bancos. etc).  No dude en solicitarnos más información.",False,renew,False,,2605.0,True,False,False,False,False,False,chalet,"Monte Alto - Zalaeta - Atocha, A Coruña","Chalet adosado en Doctor Ferrant, 15",,terracedHouse,,,,,
36,99218029,https://img3.idealista.com/blur/WEB_LISTING/0/id.pro.es.image.master/75/f6/18/1036981925.jpg,1585-B,9,1,87500.0,flat,sale,80.0,False,2,1,Os Mallos,A Coruña,A Coruña,Os Mallos,es,43.3537614,-8.411234,False,https://www.idealista.com/inmueble/99218029/,2811,"Ronda outeiro - estacion de tren. Primer piso con ascensor, sin barreras arquitectónicas, distribuido en dos dormitorios, salón, cocina y un baño. Dispone de terraza. Es interior pero muy luminoso, orientación sur. Disponemos de otro piso colindante por el mismo precio. Llámanos e infórmate sin compromiso. Inmopérez.",False,renew,False,True,1094.0,False,False,False,False,False,False,flat,"Os Mallos, A Coruña",Piso,,,,,,,
37,98847271,https://img3.idealista.com/blur/WEB_LISTING/0/id.pro.es.image.master/7e/19/72/1036887770.jpg,651C9,23,1,169000.0,flat,sale,94.0,True,3,1,Calle Poeta Trillo Figueroa,A Coruña,A Coruña,Cuatro Caminos - Plaza de la Cubela,es,43.3547526,-8.3981143,False,https://www.idealista.com/inmueble/98847271/,2507,"REFERENCIA: 651C9 - Piso de tres dormitorios y un baño en zona de la Gaiteira listo para entrar a vivir. La vivienda se compone de salón comedor, cocina independiente, tres dormitorios un baño y patio. La superficie útil de la vivienda es de 79 m2. El dormitorio principal da a la misma calle que el salón, dispone de luz directa y resulta muy agradable, tiene un gran armario. Los otros dos dormitorios tienen salida al gran patio de 30m2. La cocina es independiente, con muebles, electrodomésticos, zona de office y salida directa al patio. El cuarto de baño, con bañera, también tiene ventana por lo que la ventilación está asegurada. El patio es de grandes dimensiones y tiene la posibilidad de cubrirse, bien parcial o totalmente, con lo que se gana en intimidad y se puede disfrutar todo el año. Está en buen estado de conservación, listo para entrar a vivir. Recientemente se han hecho algunas mejoras como cambio de suelo, puertas y arreglo de patio. Está ubicado en el centro de la ciudad, muy cerca de la salida y con muy buenas conexiones. Se encuentra en el Barrio de la Gaiteira, una zona peatonal y muy tranquila con todos los servicios básicos: supermercado, transporte, colegios, centros de saludo, hospitales, comercio, farmacias, parques, zonas infantiles.. . No pierda la oportunidad de adquirir esta vivienda bien como hogar para su familia, como para inversión en el mercado de alquiler. Consúltenos rentabilidad y condiciones. Se vende sin muebles y sin decoración. Esta información no es vinculante, puede contener errores.",True,good,False,True,1798.0,True,False,False,False,False,False,flat,"Cuatro Caminos - Plaza de la Cubela, A Coruña",Piso en Calle Poeta Trillo Figueroa,,,,,,,
38,98889117,https://img3.idealista.com/blur/WEB_LISTING/0/id.pro.es.image.master/69/22/39/1026688127.jpg,23043,44,1,178000.0,flat,sale,100.0,True,3,2,Cuatro Caminos - Plaza de la Cubela,A Coruña,A Coruña,Cuatro Caminos - Plaza de la Cubela,es,43.3548031,-8.3997546,False,https://www.idealista.com/inmueble/98889117/,2503,"Maximiza tu inversión. Consigue un piso de tres dormitorios o dos apartamentos totalmente exteriores en una de las calles que más gustan de Cuatro Caminos. Te lo contamos con detalle. Te ofrecemos un piso de 100 metros a escasos metros de Ramón y Cajal y con vistas a una de las calles más demandadas de la zona por su cómoda ubicación. Un inmueble en obra con cuatro grandes ventanales a la calle que puedes convertir en un gran piso de 3 dormitorios, o bien en dos apartamentos de 1 y 2 dormitorios. En la actualidad, el inmueble solamente tiene las divisiones interiores hechas, que puedes conservar o, ya que hay que hacerlo por completo, modificar a tu gusto. Te ofrecemos la posibilidad de entregártelo para entrar a vivir por 235.000 euros en total. Situado en un edificio de los años 70 con portal accesible y ascensor a cota cero que te dejará justo al lado de la puerta de tu propiedad. Un inmueble para diseñar a tu medida con todas las comodidades que te brinda el barrio de Cuatro Caminos. Llámanos o mándanos un WhatsApp para ampliar información al 981 170 809. En AGH te ayudamos a hacer realidad tu proyecto.",False,renew,False,True,1780.0,True,False,False,False,False,False,flat,"Cuatro Caminos - Plaza de la Cubela, A Coruña",Piso,,,,,,,
39,97278046,https://img3.idealista.com/blur/WEB_LISTING/0/id.pro.es.image.master/c4/eb/70/974443451.jpg,f5,24,5,170000.0,flat,sale,66.0,True,2,2,"Faro, 57",A Coruña,A Coruña,Monte Alto - Zalaeta - Atocha,es,43.3809762,-8.4020396,True,https://www.idealista.com/inmueble/97278046/,497,"Piso de dos dormitorios en la calle Faro en Montealto, al lado de la Ronda de Montealto y a pocos metros del Paseo Marítimo a la altura de la Torre de Hércules y de las playas de Las Lapas y San Amaro. Dos dormitorios dobles con armarios empotrados. Dos baños (ducha y bañera), uno de ellos en suite en el dormitorios principal. Tendedero cubierto. Salón con cocina americana con todos los electrodomésticos y gran capacidad de almacenaje. Galerías típicas en salón y uno de los dormitorios. Calefacción acumuladores eléctricos. Vistas laterales al mar y a la Torre de Hércules desde las galerías Trastero en el mismo edificio incluido en el precio. Edificación del año 2002, vivenda en perfecto estado de conservación. Se contempla la posibilidad de alquiler con opción a compra.",False,good,False,True,2576.0,False,False,False,False,False,False,flat,"Monte Alto - Zalaeta - Atocha, A Coruña","Piso en Faro, 57",,,,,,,
40,96708249,https://img3.idealista.com/blur/WEB_LISTING/0/id.pro.es.image.master/a4/4b/23/954336912.jpg,m57,24,5,170000.0,flat,sale,66.0,True,2,2,"Faro, 57",A Coruña,A Coruña,Monte Alto - Zalaeta - Atocha,es,43.3809762,-8.4020396,True,https://www.idealista.com/inmueble/96708249/,497,"Piso de dos dormitorios en la calle Faro en Montealto, al lado de la Ronda de Montealto y a pocos metros del Paseo Marítimo a la altura de la Torre de Hércules y de las playas de Las Lapas y San Amaro.  Dos dormitorios dobles con armarios empotrados.  Dos baños (ducha y bañera), uno de ellos en suite en el dormitorios principal.  Tendedero cubierto.  Salón con cocina americana con todos los electrodomésticos y gran capacidad de almacenaje.  Galerías típicas en salón y uno de los dormitorios. Calefacción acumuladores eléctricos.  Vistas laterales al mar y a la Torre de Hércules desde las galerías  Trastero en el mismo edificio incluido en el precio.  Edificación del año 2002, vivenda en perfecto estado de conservación. Se contempla la posibilidad de alquiler con opción a compra.",False,good,False,True,2576.0,False,False,False,False,False,False,flat,"Monte Alto - Zalaeta - Atocha, A Coruña","Piso en Faro, 57",,,,,,,
41,99144901,https://img3.idealista.com/blur/WEB_LISTING/0/id.pro.es.image.master/11/af/19/1035010914.jpg,07345,25,1,155000.0,flat,sale,70.0,False,2,1,Ronda de Outeiro,A Coruña,A Coruña,Agra del Orzán - Ventorrillo,es,43.3625258,-8.423071,False,https://www.idealista.com/inmueble/99144901/,2576,"REF. 7345 VIVIENDA REFORMADA PRÓXIMO A SERVICIOS. Vivienda con reforma integral en el año 2017. Consta de 70m2 distribuídos en amplio salón comedor, cocina independiente equipada con electrodomésticos (Vitro, horno, microondas, nevera, lavavajillas. ) Dispone de 2 dormitorios, ambos con armarios empotrados. Un baño completo con plato de ducha. Cuenta con un patio interior que se accede a través de la cocina, donde ubicar lavadora y secadora (no son electrodomésticos de los que no dispone la vivienda) No tiene barreras arquitectónicas. Cuenta con suelos de tarima, y ventanas climalit oscilobatientes con rotura de puente térmico. Posibilidad de plaza de garaje en alquiler. Si quieres más información y/o concertar una visita, llámanos al 981914705 o pasa por nuestra oficina en Plaza de Vigo (Calle Menéndez y Pelayo, 12, Bajo).   Para encontrar más alternativas.",False,good,False,True,2214.0,False,False,False,False,False,False,flat,"Agra del Orzán - Ventorrillo, A Coruña",Piso en Ronda de Outeiro,,,,,,,
42,95959657,https://img3.idealista.com/blur/WEB_LISTING/0/id.pro.es.image.master/20/48/d5/932841229.jpg,1971,33,1,143000.0,flat,sale,100.0,True,3,2,Calle Observatorio,A Coruña,A Coruña,Agra del Orzán - Ventorrillo,es,43.3643812,-8.4215571,False,https://www.idealista.com/inmueble/95959657/,2351,"SERFISEGUR Inmobiliaria vende vivienda en A CORUÑA.  Piso en una calle peatonal de la zona del AGRA DO ORZÁN, 1ª planta con ascensor, 3 dormitorios, salón-comedor, cocina amueblada, baño, aseo, estancia para lavandería, terraza interior, distribuidor y recibidor. No dispone de plaza de garaje ni trastero. Tiene suelo de parqué, dos armarios empotrados y portero automático. El edificio tiene una sola vivienda en cada planta. La cocina tiene placa vitrocerámica, horno, campana extractora y frigorífico-combi. En la estancia de lavandería están la caldera de gas natural para el agua caliente y lavadora. Es exterior el salón-comedor y el dormitorio principal, el resto de la vivienda da a la terrada interior, incluso los baños, tiene vistas a la calle peatonal y orientación oeste.  Situado en pleno centro, a 1 km. a pie de la playa de Riazor, en una calle muy tranquila y bien comunicada, a un paso de la ronda de Nelle, ronda de Outeiro y 3ª Ronda. No pierda la oportunidad de visitar la vivienda, estaremos encantados de enseñársela.",False,good,False,True,1430.0,False,False,False,False,False,False,flat,"Agra del Orzán - Ventorrillo, A Coruña",Piso en Calle Observatorio,,,,,,,
