,propertyCode,thumbnail,externalReference,numPhotos,floor,price,propertyType,operation,size,exterior,rooms,bathrooms,address,province,municipality,district,country,latitude,longitude,showAddress,url,distance,description,hasVideo,status,newDevelopment,hasLift,priceByArea,hasPlan,has3DTour,has360,hasStaging,superTopHighlight,topNewDevelopment,detailedType.typology,suggestedTexts.subtitle,suggestedTexts.title,labels,detailedType.subTypology,neighborhood,parkingSpace.hasParkingSpace,parkingSpace.isParkingSpaceIncludedInPrice,parkingSpace.parkingSpacePrice,newDevelopmentFinished
14,98208380,https://img3.idealista.com/blur/WEB_LISTING/0/id.pro.es.image.master/9a/30/52/1005395150.jpg,2636,23,3,188000.0,flat,sale,60.0,True,2,1,Los Castros - Castrillón,A Coruña,A Coruña,Los Castros - Castrillón,es,43.352636,-8.3909203,False,https://www.idealista.com/inmueble/98208380/,2810,"Piso situado en los castros, a la entrada de la ciudad en una zona con todos los servicios con el centro de salud al frente, guarderia, colegios y donde puedes ir dando un paseo a la playa de oza o al gran parque de eiris. Es un inmueble muy soleado por su orientacion sur, portal sin barreras. La vivienda dispone de dos dormitorios, salon, una cocina amplia y muy luminosa, un baño completo y zona de lavanderia-tendedero, cuenta con armarios empotrados, calefaccion y agua caliente por gas ciudad, suelos de parket, dispone de plaza de garaje y trastero. No dudes en venir a visitarlo.",False,good,False,True,3133.0,False,False,False,False,False,False,flat,"Los Castros - Castrillón, A Coruña",Piso,,,,True,True,,
15,84192679,https://img3.idealista.com/blur/WEB_LISTING/0/id.pro.es.image.master/fd/d5/81/1025535860.jpg,ferrant,73,1,195000.0,flat,sale,82.0,True,2,2,Monte Alto - Zalaeta - Atocha,A Coruña,A Coruña,Monte Alto - Zalaeta - Atocha,es,43.3775015,-8.4006752,False,https://www.idealista.com/inmueble/84192679/,175,"PRECIOSO PISO DE DOS DORMITORIOS, SEMINUEVO EN OBRA NUEVA. En este bonito piso en Doctor Ferrant tenemos fachada nueva, ascensor nuevo acristalado y una reforma con materiales de alta calidad. Instalaciones de fontanería, electricidad y telecomunicaciones nuevos en todo el edificio lo que te garantiza unos años sin derramas. Además tienen el encanto de un piso de espacios amplios y techos muy altos con unos acabados modernos que lo convierten en un hogar muy acogedor. Dos baños, salón amplio, cocina con un buen servicio. Está en el barrio de Monte Alto a un paso a pie de la playa, de la Plaza de España con todos los servicios en la misma calle. Venga a verlo con nosotras. Estamos deseando mostrárselo.",False,good,False,True,2378.0,False,False,False,False,False,False,flat,"Monte Alto - Zalaeta - Atocha, A Coruña",Piso,,,,,,,
16,97927506,https://img3.idealista.com/blur/WEB_LISTING/0/id.pro.es.image.master/35/2a/e4/995256461.jpg,B221,18,2,90000.0,flat,sale,77.0,True,2,1,"Calle Eugenio Carré Aldao, 22",A Coruña,A Coruña,Os Mallos,es,43.3558783,-8.4113763,True,https://www.idealista.com/inmueble/97927506/,2598,"Presentamos una oportunidad con mayúsculas! En un edificio con fachadas y portal recientemente rehabilitados, planta 2ª, actualmente sin ascensor pero con posibilidades de instalarlo a futuro. Encontramos un piso de dos dormitorios que precisa actualización de cocina, baño, tarima y pintura. Tiene las ventanas nuevas y las puertas de paso en muy buen estado. Disponible a partir del 15 de Julio te puedes anotar en la lista de espera para visita desde ahora mismo! Ubicado a 5 metros de la parada del bus Nº11 que recorre la ciudad de A Coruña, a 10 metros de enlace con la Ronda de Outeiro y la Ronda de Nelle te hará la vida muy fácil. Además estamos en un barrio consolidado que cuenta con todos los servicios a escasos metros del portal. Si lo ves con ojos de inversión es una de las zonas más demandadas para alquiler. Te estamos esperando! [IW].",False,good,False,False,1169.0,False,False,False,False,False,False,flat,"Os Mallos, A Coruña","Piso en Calle Eugenio Carré Aldao, 22",,,,,,,
17,98932576,https://img3.idealista.com/blur/WEB_LISTING/0/id.pro.es.image.master/40/1c/3b/1028326201.jpg,07327,12,1,178000.0,flat,sale,50.0,False,1,1,Calle Miguel Servet,A Coruña,A Coruña,Monte Alto - Zalaeta - Atocha,es,43.373987,-8.3956352,False,https://www.idealista.com/inmueble/98932576/,435,"REF. 7327 ORILLAMAR-CALLE DE LA TORRE Perfecto para inversión, actualmente alquilado. En una de las zonas más demandadas de la ciudad, en el barrio de Monte Alto, a pocos metros de una de las calles mas conocidas y emblemáticas de la cidad: La Calle de La Torre, y proximo a Orillamar. En sus inmediaciones todos los servicios necesarios: centro de salud, farmacia, paradas de autobús y de Taxi, supermercados, bares. El apartamento consta de 50m2, distribuidos en un salón comedor luminoso, una cocina independiente equipada con todos los electrodomésticos, un dormitorio con armario empotrado, y un baño completo con plato de ducha. Suelos de parquet, ventanas climalit, calefacción por gas natural. Si quieres más información y/o concertar una visita, llámanos al 981914705 o pasa por nuestra oficina en Plaza de Vigo (Calle Menéndez y Pelayo 12, Bajo). Para encontrar más alternativas en  .",True,good,False,True,3560.0,False,False,False,False,False,False,flat,"Monte Alto - Zalaeta - Atocha, A Coruña",Piso en Calle Miguel Servet,"[{'name': 'apartamentoType', 'text': 'Apartamento'}]",,,,,,
18,99128660,https://img3.idealista.com/blur/WEB_LISTING/0/id.pro.es.image.master/ab/cc/c3/1034478403.jpg,E1232,7,3,80000.0,flat,sale,58.0,True,3,1,Calle Monasterio de Caaveiro,A Coruña,A Coruña,Agra del Orzán - Ventorrillo,es,43.3641533,-8.4258262,False,https://www.idealista.com/inmueble/99128660/,2647,"Fantástico piso a estrenar en las inmediaciones de la Ronda de Outeiro, muy próximo a la Calle Monasterio de Caaveiro, 15010, A Coruña Una vivienda recién reformada de 52 m2 de los cuales aproximadamente 49 m2 son útiles y cuenta con 3 habitaciones y 1 baño. Accedemos a la vivienda a un amplio salón comedor con cocina americana, completamente amueblada y equipada. Siguiendo el pasillo encontramos las 3 habitaciones y el cuarto de baño completo. Cuenta además con suelos de tarima y calefaccion individual. Aunque actualmente el edificio no dispone de ascensor ni de aprobación al respecto sí cuenta con la posibilidad de instalarlo. Nuestro lema es la excelencia y trabajamos día a día para mantenerla. Hacemos la experiencia de compra o venta de un inmueble única para cada uno de nuestros clientes y propietarios. Bienvenidos a la singularidad, bienvenidos a Incor. OFRECEMOS SOLUCIONES, NO PROMESAS Encuentra más en.",False,good,False,False,1379.0,False,False,False,False,False,False,flat,"Agra del Orzán - Ventorrillo, A Coruña",Piso en Calle Monasterio de Caaveiro,,,,,,,
19,96979008,https://img3.idealista.com/blur/WEB_LISTING/0/id.pro.es.image.master/c1/47/12/962074535.jpg,E1122,11,6,142000.0,flat,sale,84.0,True,3,1,Calle Tornos,A Coruña,A Coruña,Sagrada Familia,es,43.3613226,-8.4170439,False,https://www.idealista.com/inmueble/96979008/,2323,"Este piso a reformar se encuentra en Praza Tornos, 15007, A Coruña. En la sexta panta encontramos este soleado piso, construido en el año 1966, que tiene 84 m2 de los cuales 78 m2 son útiles, distribuidos en 3 dormitorios, un salón, un amplia cocina con zona de lavadero, hall recibidor y un cuarto de baño completo. Completamente exterior y muy luminoso con calefacción de gas natural individual, tendedero, acceso personas con movilidad reducida, suelo tarima, lavadero, extractor de humos, ventanas aluminio, antena tv, armarios empotrados y ascensor.  OFRECEMOS SOLUCIONES, NO PROMESAS Encuentra más en.",False,renew,False,True,1690.0,False,False,False,False,False,False,flat,"Sagrada Familia, A Coruña",Piso en Calle Tornos,,,,,,,
20,98296231,https://img3.idealista.com/blur/WEB_LISTING/0/id.pro.es.image.master/fb/e5/b4/1007061924.jpg,E1194,15,1,135000.0,flat,sale,90.0,False,3,1,Calle Alcalde Lens,A Coruña,A Coruña,Agra del Orzán - Ventorrillo,es,43.3615587,-8.4188509,False,https://www.idealista.com/inmueble/98296231/,2400,"Fantástico piso en la calle Alcalde Lens, en las inmediaciones de la plaza de As Conchiás en la residencial zona de la Calle Barcelona, 15010 A Coruña. Hablamos de un piso de aproximadamente 83m2 que cuenta con salón comedor, cocina completamente equipada y amueblada, 3 dormitorios, un cuarto de baño completo y una amplia terraza privada. En muy buen estado, con una reforma reciente, suelos de tarima, ventanas climalit, calefacción eléctrica. en un edificio con ascensor. en la residencial y comercial zona de la Calle Barcelona con todos los servicios al alcance. ¿quieres saber más? Nuestro lema es la excelencia y trabajamos día a día para mantenerla. Hacemos la experiencia de compra o venta de un inmueble única para cada uno de nuestros clientes y propietarios. Bienvenidos a la singularidad, bienvenidos a Incor. OFRECEMOS SOLUCIONES, NO PROMESAS Encuentra más en.",False,renew,False,True,1500.0,False,False,False,False,False,False,flat,"Agra del Orzán - Ventorrillo, A Coruña",Piso en Calle Alcalde Lens,,,,,,,
21,97623390,https://img3.idealista.com/blur/WEB_LISTING/0/id.pro.es.image.master/6a/ca/16/985114310.jpg,31748,17,2,64000.0,flat,sale,66.0,True,3,1,Calle San Isidoro,A Coruña,A Coruña,Sagrada Familia,es,43.356726,-8.4193322,False,https://www.idealista.com/inmueble/97623390/,2839,"Piso para reformar con cómoda distribución, sus tres habitaciones son exteriores a la calle, salón, baño y cocina. Puedes hacer la reforma a tus necesidades como tu primera vivienda o para alquilarla y sacar mas rentabilidad por tu dinero. Situada a unos pocos metros de la calle peatonal Barcelona, con una amplia variedad de servicios, centro médicos, farmacias, terrazas, tiendas, restaurantes, colegios, todo a un paso de casa. Una interesante opción, tanto como propietari@ con tu nueva vivienda, dejando atrás los alquileres, o comenzando como inversor inmobiliario.  Los propietarios nos han confiado la venta de esta propiedad. Disponemos de toda la información necesaria para garantizar a los interesados la total transparencia en la gestión.  Si es agente inmobiliario y tiene un cliente interesado, llámenos y colaboraremos.",False,renew,False,False,970.0,False,False,False,False,False,False,flat,"Sagrada Familia, A Coruña",Piso en Calle San Isidoro,,,,,,,
22,97988088,https://img3.idealista.com/blur/WEB_LISTING/0/id.pro.es.image.master/0c/f1/ba/1008482643.jpg,E1181,17,1,160000.0,flat,sale,74.0,True,1,1,Ronda Nelle,A Coruña,A Coruña,Os Mallos,es,43.3600334,-8.4119783,False,https://www.idealista.com/inmueble/97988088/,2206,"Os presentamos esta fantástica promoción de viviendas desde un dormitorio en un edificio completamente rehabilitado con todas sus viviendas a estrenar; recien reformadas con las mejores calidades, completamente exteriores, soleadas y luminosas. Nos encontramos en la calle San Sebastián, A Coruña, en las inmediaciones de la ronda de Nelle, en una zona residencial con todos los servicios y comodidades. Concretamente os hablamos de la vivienda de un dormitorio situada en la planta primera y que cuenta 74m2 de los cuales 66m2 serían útiles. Accedemos a la vivienda a un amplio salón comedor con cocina americana completamente equipada y amueblada. A mano derecha encontramos el dormitorio principal y el amplio cuarto de baño completo.  Cuenta además con ascensor, calefacción gas natural individual, acceso personas con movilidad reducida y ventanas climalit y armarios empotrados. Nuestro lema es la excelencia y trabajamos día a día para mantenerla. Hacemos la experiencia de compra o venta de un inmueble única para cada uno de nuestros clientes y propietarios. Bienvenidos a la singularidad, bienvenidos a Incor. OFRECEMOS SOLUCIONES, NO PROMESAS Encuentra más en.",False,good,False,True,2162.0,False,False,False,False,False,False,flat,"Os Mallos, A Coruña",Piso en Ronda Nelle,,,,,,,
23,97988125,https://img3.idealista.com/blur/WEB_LISTING/0/id.pro.es.image.master/2d/e2/da/997264401.jpg,E1180,19,5,175000.0,penthouse,sale,82.0,True,1,1,Ronda Nelle,A Coruña,A Coruña,Os Mallos,es,43.3604334,-8.4107783,False,https://www.idealista.com/inmueble/97988125/,2121,"Os presentamos esta fantástica promoción de viviendas desde un dormitorio en un edificio completamente rehabilitado con todas sus viviendas a estrenar; recien reformadas con las mejores calidades, completamente exteriores, soleadas y luminosas. Nos encontramos en la calle San Sebastián, 15007, A Coruña, en las inmediaciones de la ronda de Nelle, en una zona residencial con todos los servicios y comodidades. Concretamente os hablamos de la planta ático que cuenta además con terraza. Distribuída tipo loft, accedemos a la vivienda a un amplio salón comedor con cocina americana completamente equipada y amueblada, y con espacio para la zona de dormitorio. A mano izquierda encontramos además una zona separada para lavadero y a mano derecha un amplio cuarto de baño completo. Cuenta además con ascensor, calefacción gas natural individual, acceso personas con movilidad reducida y entre sus acabados, ventanas climalit, suelo tarima y vigas de madera vistas. Nuestro lema es la excelencia y trabajamos día a día para mantenerla. Hacemos la experiencia de compra o venta de un inmueble única para cada uno de nuestros clientes y propietarios. Bienvenidos a la singularidad, bienvenidos a Incor. OFRECEMOS SOLUCIONES, NO PROMESAS Encuentra más en.",False,good,False,True,2134.0,False,False,False,False,False,False,flat,"Os Mallos, A Coruña",Ático en Ronda Nelle,,penthouse,,,,,
24,95607358,https://img3.idealista.com/blur/WEB_LISTING/0/id.pro.es.image.master/16/bc/3f/923191698.jpg,P0420,18,1,140000.0,flat,sale,67.0,True,2,1,Avenida Arteixo,A Coruña,A Coruña,Os Mallos,es,43.3572955,-8.4144179,False,https://www.idealista.com/inmueble/95607358/,2568,"Piso con excelente situación en Avenida de Arteixo, muy soleado. Vivienda con forma regular y sin pérdidas de espacio, con múltiples posibilidades de redistribución, amplios ventanales a la fachada principal a la que se asoman el salón y el dormitorio principal, ambos con su habitación italiana vinculada. Al patio posterior se encuentran la cocina, segundo dormitorio y cuarto de baño con ventana. Techos altos con molduras, toma para gas ciudad, plato de ducha y mampara nuevos en el cuarto de baño, al igual que lavadora y lavavajillas, suelos de parquet y baldosín decorado antiguo, ventanas con acristalamiento climalit. Edificio sin barreras arquitectónicas, instalándose ascensor.   Necesita reformar algunos elementos aunque perfectamente habitable en su estado actual. Próximo a estación de ferrocarril, parque de Vioño, a 10 minutos de Juan Flórez o Cuatro Caminos.",False,renew,False,False,2090.0,False,False,False,False,False,False,flat,"Os Mallos, A Coruña",Piso en Avenida Arteixo,,,,,,,
25,96800581,https://img3.idealista.com/blur/WEB_LISTING/0/id.pro.es.image.master/15/10/ed/956910566.jpg,E1110,10,5,91000.0,flat,sale,93.0,False,3,1,Calle Monasterio de Caaveiro,A Coruña,A Coruña,Agra del Orzán - Ventorrillo,es,43.3643295,-8.4248449,False,https://www.idealista.com/inmueble/96800581/,2570,"Este piso a reformar se encuentra en Rúa Monasterio de Caaveiro, 15010, A Coruña, A Coruña, en la zona del AGRA DEL ORZA. Quinta planta, construída en el año 1970, que cuenta con 93 m2 de superficie de los cuales 77 m2 son útiles y dispone de 3 habitaciones, 1 baños, cocina independiente y amplio salón. Incluye suelo mármol, ascensor, calefacción individual, interior, acceso personas con movilidad reducida, armarios empotrados y estructura de hormigón.  Buscas alta rentabilidad para tu inversión? esta es tu oportunidad! OFRECEMOS SOLUCIONES, NO PROMESAS Encuentra más en.",False,renew,False,True,978.0,False,False,False,False,False,False,flat,"Agra del Orzán - Ventorrillo, A Coruña",Piso en Calle Monasterio de Caaveiro,,,,,,,
26,95689210,https://img3.idealista.com/blur/WEB_LISTING/0/id.pro.es.image.master/d0/86/74/925566884.jpg,VENC1708,18,7,195000.0,flat,sale,90.0,True,4,2,Cuatro Caminos,A Coruña,A Coruña,Cuatro Caminos - Plaza de la Cubela,es,43.3550878,-8.4026172,False,https://www.idealista.com/inmueble/95689210/,2491,"Piso en Cuatro Caminos. Se trata de una vivienda con orientación Sur-Este de 80m² útiles distribuidos en salón comedor, cocina independiente totalmente amueblada, 4 dormitorios, 1 cuarto de baño con plato de ducha y 1 aseo. Calefacción centralizada, suelos en parquet, ventanas cambiadas de aluminio con cristal climalit. Portal sin barreras arquitectónicas. La vivienda está situada en una zona muy céntrica, donde poder disfrutar de todos los servicios. A pocos minutos a pie de las estaciones de autobús y ferrocarril, con entrada y salida directa de la ciudad en coche. Urbenorte.",False,renew,False,True,2167.0,False,False,False,False,False,False,flat,"Cuatro Caminos - Plaza de la Cubela, A Coruña",Piso en Cuatro Caminos,,,,,,,
27,98805828,https://img3.idealista.com/blur/WEB_LISTING/0/id.pro.es.image.master/c5/48/3d/1024376849.jpg,V1069P,17,2,115000.0,flat,sale,84.0,True,3,1,Plaza padres rubinos,A Coruña,A Coruña,Os Mallos,es,43.3570852,-8.4126679,False,https://www.idealista.com/inmueble/98805828/,2521,"Se vende piso en la zona de Los Mallos. Segunda planta sin ascensor, vivienda por altura. Consta de luminoso salón comedor, cocina independiente, amueblada y equipada. Tres dormitorios, uno de ellos es en italiana, ideal como vestidor. Un cuarto de baño completo con plato de ducha. Dispone de calefacción eléctrica instalada recientemente. La vivienda está ubicada en una zona muy bien comunicada con todos los servicios a mano. Posibilidad de financiación del 100 % Para más inmuebles consulta nuestra web privada.",False,good,False,False,1369.0,False,False,False,False,False,False,flat,"Os Mallos, A Coruña",Piso en Plaza padres rubinos,,,,,,,
28,98712808,https://img3.idealista.com/blur/WEB_LISTING/0/id.pro.es.image.master/17/04/5e/1021346572.jpg,V1067P,11,1,180000.0,flat,sale,44.0,True,1,1,Calle orzán,A Coruña,A Coruña,Monte Alto - Zalaeta - Atocha,es,43.3686053,-8.4046147,False,https://www.idealista.com/inmueble/98712808/,1085,"Se vende apartamento a tan sólo 1 minuto de la céntrica Plaza de Pontevedra. Vivienda totalmente reformada incluyendo instalación de electricidad como fontanería. Primera planta sin ascensor que dispone de salón, cocina amueblada y equipada, dormitorio en italiana con ventanal y cuarto de baño completo con plato de ducha. Tanto la fachada como la cubierta del edificio han sido renovadas hace tres años Posibilidad de financiación del 100%. Para más inmuebles consulta en nuestra web.",False,good,False,False,4091.0,False,False,False,False,False,False,flat,"Monte Alto - Zalaeta - Atocha, A Coruña",Piso en Calle orzán,"[{'name': 'apartamentoType', 'text': 'Apartamento'}]",,,,,,
29,95133849,https://img3.idealista.com/blur/WEB_LISTING/0/id.pro.es.image.master/e1/b0/62/907094131.jpg,CV090,3,,198000.0,chalet,sale,91.0,False,2,1,Doctor Ferrant,A Coruña,A Coruña,Monte Alto - Zalaeta - Atocha,es,43.3799313,-8.4033713,False,https://www.idealista.com/inmueble/95133849/,489,"Casa adosada en Monte Alto.  Es de planta baja y actualmente está distribuida con dos dormitorios, un baño, salón, cocina, almacén y jardín en la parte de atrás.  El solar tiene 131 metros cuadrados.  Necesita reforma.  Posibilidad de subir tres alturas + bajo cubierta.",False,renew,False,,2176.0,True,False,False,False,False,False,chalet,"Monte Alto - Zalaeta - Atocha, A Coruña",Chalet adosado en Doctor Ferrant,,terracedHouse,,,,,
30,95580216,https://img3.idealista.com/blur/WEB_LISTING/0/id.pro.es.image.master/69/e9/72/922445090.jpg,,20,1,155000.0,flat,sale,124.0,True,4,2,Barcelona s/n,A Coruña,A Coruña,Agra del Orzán - Ventorrillo,es,43.3602083,-8.419833,True,https://www.idealista.com/inmueble/95580216/,2565,"Piso a reformar, en calle Barcelona ( A Coruña ). 4 dormitorios, 2 baños, cocina, salón y amplia terraza DE USO COMUNITARIO. Ubicado en una zona con todos los servicios, buenas conexiones con polígonos y accesos de salida ciudad. Primera planta, con ventanas todas exteriores.",False,renew,False,True,1250.0,False,False,False,False,False,False,flat,"Agra del Orzán - Ventorrillo, A Coruña",Piso en Barcelona s/n,,,,,,,
31,93700250,https://img3.idealista.com/blur/WEB_LISTING/0/id.pro.es.image.master/45/4f/ab/869556654.jpg,1376,28,1,166000.0,flat,sale,87.0,True,3,2,antonio pedreira rios,A Coruña,A Coruña,Agra del Orzán - Ventorrillo,es,43.3612759,-8.4230389,False,https://www.idealista.com/inmueble/93700250/,2664,"Ref 1376. Piso muy cerca del Agora totalmente reformado. Se compone de salón comedor cocina amueblada con electrodomésticos y con zona de tendedero anexa, 3 dormitorios (2 de ellos con armarios empotrados) y dos baños. Suelos de parquet, ventanas oscilobatientes. Ascensor. Solo 40 € de gastos de comunidad. INMOBILIARIA ATICO.",False,good,False,True,1908.0,False,False,False,False,False,False,flat,"Agra del Orzán - Ventorrillo, A Coruña",Piso en antonio pedreira rios,,,,,,,
32,97502398,https://img3.idealista.com/blur/WEB_LISTING/0/id.pro.es.image.master/4d/ba/64/981344113.jpg,PV456,25,4,99000.0,flat,sale,96.0,True,2,1,Cerca,A Coruña,A Coruña,Los Castros - Castrillón,es,43.3532258,-8.3937018,False,https://www.idealista.com/inmueble/97502398/,2704,"Piso situado en la calle Cerca, en la zona de Los Castros/Castrillón.  Necesita reforma, tiene 96 metros cuadrados construidos y está distribuido con dos habitaciones, un baño con bañera, cocina independiente y salón con italiana.  Instalación de gas natural en el edificio.  Cuarta planta sin ascensor.",False,renew,False,False,1031.0,False,False,False,False,False,False,flat,"Los Castros - Castrillón, A Coruña",Piso en Cerca,,,,,,,
33,98792252,https://img3.idealista.com/blur/WEB_LISTING/0/id.pro.es.image.master/cb/af/68/1023959682.jpg,4475,19,1,170000.0,flat,sale,83.0,False,3,2,Calle Antonio Pedreira Ríos,A Coruña,A Coruña,Agra del Orzán - Ventorrillo,es,43.3617759,-8.4222389,False,https://www.idealista.com/inmueble/98792252/,2579,"Piso en venta totalmente exterior y haciendo esquina. Cerca de la Ronda de Outeiro, de la zona comercial de la calle Barcelona, a un paso del Estadio de Riazor,   de la Casa del Agua y de la universidad de Naútica, UNED y de la Escuela Oficial de Idiomas. Cuenta también con todos los servicios cercanos, como supermercados, farmacias, cafeterías, colegios de primaria e institutos, paradas de bus y de taxi. Dispone de tres dormitorios, salón-comedor, cocina amueblada y equipada, dos baños y cuarto trastero. Los suelos son de tarima flotante de roble y el resto de la carpintería en concordancia. Tiene además ventanas del tipo climalit y oscilobatientes. En el portal no hay barreras arquitectónicas.   ¡IDEAL INVERSIÓN! Si necesita más información y quiere visitar esta propiedad, no dude en contactar con nosotros mediante nuestro número de teléfono 981-17-37-38 en horario comercial de Lunes a Viernes. Igualmente, le invitamos a visitar nuestra página web para ver esta u otras propiedades que pudieran ser de su interés.",True,good,False,True,2048.0,False,False,False,False,False,False,flat,"Agra del Orzán - Ventorrillo, A Coruña",Piso en Calle Antonio Pedreira Ríos,,,,,,,
34,98999611,https://img3.idealista.com/blur/WEB_LISTING/0/id.pro.es.image.master/e0/45/97/1030960129.jpg,,13,6,125000.0,flat,sale,52.0,True,2,1,alcalde liaño flores,A Coruña,A Coruña,Agra del Orzán - Ventorrillo,es,43.3612377,-8.4249597,False,https://www.idealista.com/inmueble/98999611/,2785,"Piso totalmente reformado, luminoso, muy acogedor. Consta de dos dormitorios, baño, salón y cocina semi-americana.  Planta 6 con ascensor. Situado en la Calle Alcalde Liaño Flores con todos los servicios alrededor.  Edificio con el portal reformado recientemente e dispone de instalación de un elevador para silla de ruedas en el portal. La vivienda actualmente está distribuida en una zona de salón-comedor con cocina semi-americana, dos dormitorios y un baño con plato de ducha.",False,good,False,True,2404.0,False,False,False,False,False,False,flat,"Agra del Orzán - Ventorrillo, A Coruña",Piso en alcalde liaño flores,,,,,,,
35,98740987,https://img3.idealista.com/blur/WEB_LISTING/0/id.pro.es.image.master/da/7a/2e/1022210792.jpg,07309,14,4,145000.0,flat,sale,55.0,False,1,1,Calle Orzán,A Coruña,A Coruña,Ensanche - Juan Florez,es,43.3710376,-8.4046197,False,https://www.idealista.com/inmueble/98740987/,853,"REF. 7309 PRÓXIMO AL CENTRO Y PASEO MARÍTIMO ACTUALMENTE ALQUILADO (LARGA DURACIÓN), PARA INVERSORES INTERESADOS. A pocos metros de la Plaza de Pontevedra, y del Paseo Marítimo y sus playas.. . se encuentra este maravilloso apartamento. Recién reformado, y con una orientación sur-oeste, se trata de una vivienda muy luminosa. Consta de un salón, cocina americana equipada con electrodomésticos, 1 dormitorio con armario empotrado, y un baño completo con plato de ducha. Cuenta con calefacción eléctrica. Es una 4ª planta, sin ascensor. Buena rentabilidad. Si quieres más información y/o concertar una visita, llámanos al 981914705 o pasa por nuestra oficina en Plaza de Vigo (Calle Menéndez y Pelayo 12, Bajo). Para encontrar más alternativas en  .",True,good,False,False,2636.0,False,False,False,False,False,False,flat,"Ensanche, A Coruña",Piso en Calle Orzán,"[{'name': 'apartamentoType', 'text': 'Apartamento'}]",,Ensanche,,,,
