,propertyCode,thumbnail,externalReference,numPhotos,floor,price,propertyType,operation,size,exterior,rooms,bathrooms,address,province,municipality,district,country,latitude,longitude,showAddress,url,distance,description,hasVideo,status,newDevelopment,hasLift,priceByArea,hasPlan,has3DTour,has360,hasStaging,superTopHighlight,topNewDevelopment,detailedType.typology,suggestedTexts.subtitle,suggestedTexts.title,labels,detailedType.subTypology,neighborhood,parkingSpace.hasParkingSpace,parkingSpace.isParkingSpaceIncludedInPrice,parkingSpace.parkingSpacePrice,newDevelopmentFinished
9,95004191,https://img3.idealista.com/blur/WEB_LISTING/0/id.pro.es.image.master/c4/50/b4/966284921.jpg,Ma - 0113,36,2,144000.0,flat,sale,77.0,False,3,1,Plaza de las Conchiñas,A Coruña,A Coruña,Agra del Orzán - Ventorrillo,es,43.3629462,-8.4178781,False,https://www.idealista.com/inmueble/95004191/,2235,"¡Increíble piso en las CONCHIÑAS, al lado de la Ronda de Nelle y a escasos minutos del centro de CORUÑA! . Zona EJEMPLAR con todos los SERVICIOS alrededor, farmacias, líneas de autobuses, restaurantes, bares…etc. Con un total de 75 m2, la vivienda posee 3 habitaciones con tarima ac5, ventanas CLIMALIT correderas y un almacenamiento ideal en cada estancia con ARMARIOS EMPOTRADOS. Salón AMPLIO y acogedor, con mesa comedor y un enorme sofá. La ESPACIOSA cocina cuenta con todos los electrodomésticos, lavadora SECADORA, vitrocerámica, tendal exterior…etc.  Baño completo que da servicio a toda la casa muy bien distruído.  TODA LA PROPIEDAD ESTÁ EN UN ESTADO IMPECABLE. Cuenta con una terraza INMENSA comunitaria. Ante cualquier duda, no dudes en ponerte en contacto con nosotros y te atenderemos encantados.",True,good,False,False,1870.0,True,False,False,False,False,False,flat,"Agra del Orzán - Ventorrillo, A Coruña",Piso en Plaza de las Conchiñas,,,,,,,
10,98062319,https://img3.idealista.com/blur/WEB_LISTING/0/id.pro.es.image.master/33/e0/36/999682713.jpg,Ma - 0226,21,1,180000.0,flat,sale,55.0,True,1,1,orzan,A Coruña,A Coruña,Ensanche - Juan Florez,es,43.3682376,-8.4054197,False,https://www.idealista.com/inmueble/98062319/,1151,"Presentamos este PRECIOSO piso al lado de la PLAYA, en una de las MEJORES ZONAS de La Coruña! . Disfruta de una vivienda RECIÉN REFORMADA, ubicado en una calle tranquila pero en pleno corazón de La Coruña, al lado de la playa, a un paso de la Plaza de Pontevedra y con todos los servicios cerca: farmacias, supermercados, colegios, restaurantes, tiendas, transporte público. Sin duda una zona idílica para vivir. El piso tiene 55 m2 y se distribuye en hall, salón, cocina, 1 habitación y un baño completo Al entrar en la vivienda nos encontramos con el hall, el salón y la cocina, todo ello en un espacio abierto.  La cocina está equipada con todos los electrodomésticos, nevera combi, lavadora, horno, y placa vitrocerámica. La cocina tiene también una ventana con salida al patio del edificio por lo que recibe luz por ambos lados. El dormitorio, es habitación ITALIANA, cuenta con unos AMPLIOS ARMARIOS BLANCOS; el BAÑO reformado, con ventana y completo con plato de ducha y mampara de cristal. VIDEO DISPONIBLE EN EL ANUNCIO!",True,good,False,False,3273.0,True,False,False,False,False,False,flat,"Ensanche, A Coruña",Piso en orzan,,,Ensanche,,,,
11,98085868,https://img3.idealista.com/blur/WEB_LISTING/0/id.pro.es.image.master/b4/91/9d/1013752129.jpg,Br-0138,35,5,190000.0,flat,sale,56.0,True,2,1,Calle monte alto,A Coruña,A Coruña,Monte Alto - Zalaeta - Atocha,es,43.3802453,-8.4019825,False,https://www.idealista.com/inmueble/98085868/,430,"Presentamos este PISAZO con terraza en pleno centro de una de las zonas más buscadas de la ciudad, MONTE ALTO. A un paso de todos los servicios, playas, la torre de Hércules y el centro de la ciudad! . Este INCREÍBLE piso se distribuye de la siguiente forma: 2 CÓMODAS habitaciones, ambas con armario empotrado. La habitación PRINCIPAL cuenta con salida directa a la terraza, AMPLIA y SOLEADA todos los mediodías. Un PRECIOSO cuarto de baño con plato de ducha, una ESPACIOSA cocina americana, completamente equipada (horno, nevera, placa de inducción, lavavajillas.. . ) el salón está a los pies de una LUMINOSA galería. Condiciones óptimas, suelos de parquet y un cómodo trastero. Llámenos y le informaremos sin compromiso. Este anuncio no es vinculante y puede cometer errores, se muestra a título informativo y no contractual.",True,good,False,True,3393.0,True,False,False,False,False,False,flat,"Monte Alto - Zalaeta - Atocha, A Coruña",Piso en Calle monte alto,,,,,,,
12,97127116,https://img3.idealista.com/blur/WEB_LISTING/0/id.pro.es.image.master/f7/c0/b9/967190022.jpg,08562,18,5,115000.0,flat,sale,66.0,True,2,1,Sagrada Familia,A Coruña,A Coruña,Sagrada Familia,es,43.3566928,-8.4180583,False,https://www.idealista.com/inmueble/97127116/,2782,"_Estupendo piso en zona Mallos, zona muy demandada en alquiler. Se trata de un edificio de cinco alturas, dos pisos por planta. Quinto con ascensor, portal sin barreras arquitectónicas. _Consta de 66 m2 útiles distribuidos actualmente en salón con cocina americana, dos habitaciones dobles, una de ellas con armario empotrado y un baño completo con plato de ducha. Ambas habitaciones dan a la fachada principal y la cocina da a un patio de manzana muy amplio, el piso es totalmente exterior y muy soleado.   _El piso ha sido reformado integralmente, fontanería, electricidad, los suelos, capintería interior, baño y cocina nuevos. Agua caliente mediante termo eléctrico de 100 litros. Ideal para empezar a rentabilizar desde el primer momento. ENSEÑA ASINMO.",False,good,False,True,1742.0,True,False,True,False,False,False,flat,"Sagrada Familia, A Coruña",Piso,,,,,,,
13,99195965,https://img3.idealista.com/blur/WEB_LISTING/0/id.pro.es.image.master/17/1a/bc/1036272039.jpg,133850,27,3,185000.0,flat,sale,85.0,True,3,1,Calle San Rosendo,A Coruña,A Coruña,Os Mallos,es,43.3536823,-8.4135189,False,https://www.idealista.com/inmueble/99195965/,2892,"De particular a particular, sin comisión para el comprador. Piso de 85 m² en Coruña (A), provincia de A Coruña. Por el espacio que te ofrece, este piso es ideal para una familia con hijos.  Se encuentra en un 3º piso con ascensor y se distribuye en un salón, una cocina amueblada, totalmente independiente del resto de estancias y equipada con electrodomésticos, tres habitaciones y un baño. Además, el piso cuenta con una práctica galería para aumentar el espacio. El inmueble es todo exterior. También cuenta con trastero para que guardes todo aquello que necesites. Este piso, situado en una vía de fácil acceso,  La vivienda, se vende amueblada y necesita reforma. En cuanto a las calidades, este piso cuenta con calefacción eléctrica, carpintería de aluminio y suelo de parquet, que da mucha calidez a la vivienda.  Esta casa está situada en una zona bien comunicada, muy cerca de la parada de autobús y la estación de tren. Para mayor comodidad, la vivienda se encuentra muy cerca de un centro médico y de un colegio.  h1o3u3s8e5l0l.",False,renew,False,True,2176.0,True,False,False,False,False,False,flat,"Os Mallos, A Coruña",Piso en Calle San Rosendo,,,,,,,
14,98761306,https://img3.idealista.com/blur/WEB_LISTING/0/id.pro.es.image.master/f1/70/60/1022876584.jpg,08622,24,2,98000.0,flat,sale,70.0,False,2,1,Os Mallos,A Coruña,A Coruña,Os Mallos,es,43.358247,-8.4126044,False,https://www.idealista.com/inmueble/98761306/,2405,"ASINMO te ofrece Piso muy Próximo a la Avda. de Arteixo. Excelente ubicación. _ Ideal tanto para familias como para destinar a alquiler. Buena rentabilidad. _ Se encuentra ubicado en una segunda planta con ascensor que ha sido instalado recientemente, dejando el portal sin barreras arquitectónicas. _ Se distribuye en: _ 1 Cocina Independiente con espacio suficiente para comer en el día a día. _ 1 Baño con plato de ducha y ventana;   por la que le entra ventiliación y luz natural. _ 2 Dormitorios espaciosos. _ 1 Salón con habitación italiana anexa actualmente como comedor. _ Acondicionado con calefacción eléctrica. Agua sanitaria a través de butano.   _ La vivienda no da a fachada principal. Da a patios pero es clarito. Se encuentra habitable aunque necesita actualización. Se puede vivir en él. _ Mejor Ver. Enseña Asinmo.  .",False,good,False,True,1400.0,False,False,True,False,False,False,flat,"Os Mallos, A Coruña",Piso,,,,,,,
15,99211590,https://img3.idealista.com/blur/WEB_LISTING/0/id.pro.es.image.master/b4/d2/16/1037588836.jpg,IF131,29,1,185000.0,flat,sale,120.0,True,4,2,Avenida Ejército,A Coruña,A Coruña,Cuatro Caminos - Plaza de la Cubela,es,43.3549552,-8.39863,False,https://www.idealista.com/inmueble/99211590/,2484,"Impresionante inmueble, techos altos con molduras, un piso por planta, acceso directo del ASCENSOR a la vivienda con llave individual.. . Esta magnífica vivienda está llena de posibilidades.   Actualmente está distribuida en cocina independiente, cuarto de baño con ventana y 4 habitaciones exteriores con ventana y dos habitaciones italianas (con luz y ventilación a través de una estancia contigua)     Adjuntamos plano de la distribución actual, así como también de una propuesta de distribución (personalizable al gusto del cliente, se podría elegir entre 3 y 4 dormitorios), distribuido en amplísima zona de día (la cocina puede ir abierta al salón o separada mediante forja y cristal), lavadero, cuarto de baño general, tres dormitorios (con posibilidad de hacer cuatro dormitorios), el principal con VESTIDOR y cuarto de baño incorporado. Posibilidad de adquirir el inmueble con la reforma contratada con precio cerrado.    Gran oportunidad de adquirir una vivienda en una zona excelente, con vistas despejadas, sin edificios delante, rodeado de zonas verdes y deportivas, con todos los servicios a un paso de casa.    Para más información o para concertar una cita, le atendemos en nuestra oficina ubicada en la calle Pastor Díaz, número 24, a través del teléfono 981,91, 86,85 o a través de WhatsApp en el 654,506, 408.    Este anuncio no es vinculante, puede contener errores. Se muestra a título informativo y no contractual.",True,good,False,True,1542.0,True,False,False,False,False,False,flat,"Cuatro Caminos - Plaza de la Cubela, A Coruña",Piso en Avenida Ejército,,,,,,,
16,99003392,https://img3.idealista.com/blur/WEB_LISTING/0/id.pro.es.image.master/4d/b2/29/1031072322.jpg,,29,6,158000.0,flat,sale,55.0,True,1,1,"Calle parque, 6",A Coruña,A Coruña,Monte Alto - Zalaeta - Atocha,es,43.3763456,-8.3981805,True,https://www.idealista.com/inmueble/99003392/,109,"Rentaloo vende esta preciosa propiedad reformada con todo lujo de detalles vanguardistas y modernos, que lo convierte en el apartamento perfecto. La vivienda ofrece la posibilidad de comprar una o dos plazas de garaje, no incluidas en el precio pero negociables. Consta de un dormitorio muy luminoso y con mucho espacio, armarios empotrados y zona de televisión completan el dormitorio con vistas desde la ventana, un salón también muy amplio con recibidor que nos invita a la cocina comedor totalmente equipada y amueblada. El inmueble se encuentra muy próximo a las playas de San Amaro y Matadero, además de supermercados, restaurantes, farmacias, taxi, etc. Para agendar visitas no dude en contactar con nuestros agentes y les recordamos que está a su disposición el tour virtual de la vivienda para ver cuántas veces sea necesario e incluso tomar medidas, para acceder al tour virtual basta con pulsar el icono 3D del anuncio.",True,good,False,True,2873.0,True,True,False,False,False,False,flat,"Monte Alto - Zalaeta - Atocha, A Coruña","Piso en Calle parque, 6","[{'name': 'apartamentoType', 'text': 'Apartamento'}]",,,,,,
17,97861326,https://img3.idealista.com/blur/WEB_LISTING/0/id.pro.es.image.master/2a/1c/b2/993008292.jpg,129254,30,5,120000.0,flat,sale,70.0,True,2,1,Calle Sofía Casanova,A Coruña,A Coruña,Os Mallos,es,43.3592585,-8.4118688,False,https://www.idealista.com/inmueble/97861326/,2277,"Piso de 70 m² en A Coruña. Por el espacio que te ofrece, este piso es ideal para una familia con hijos.  Se encuentra en un quinto piso con ascensor y cuenta con un salón, dos habitaciones, un cuarto de baño y cocina amueblada, completamente independiente del resto de estancias y equipada con electrodomésticos. Además, el piso cuenta con terraza para que disfrutes del buen tiempo y una práctica galería para aumentar el espacio. El inmueble es todo exterior. También cuenta con trastero para que puedas aprovechar todo el espacio de la vivienda. Este piso, situado en una vía de fácil acceso,  La vivienda se vende amueblada En cuanto a las calidades, este piso cuenta con carpintería de aluminio y de pvc y suelo de gres, de fácil mantenimiento y gran resistencia.  Esta casa está situada en una zona céntrica y bien comunicada, muy cerca de la parada de autobús y la estación de tren. Para mayor comodidad, la vivienda se encuentra muy cerca de un hospital y de un colegio, así como de todos los servicios necesarios para el día a día.  De particular a particular. Sin comisiones. Llámanos y visita esta vivienda. h1o2u9s2e5l4l.",False,renew,False,True,1714.0,True,False,False,False,False,False,flat,"Os Mallos, A Coruña",Piso en Calle Sofía Casanova,,,,,,,
18,98354863,https://img3.idealista.com/blur/WEB_LISTING/0/id.pro.es.image.master/29/25/70/1009146814.jpg,131442,28,bj,135000.0,flat,sale,120.0,True,4,2,Ronda de Outeiro,A Coruña,A Coruña,Sagrada Familia,es,43.3597071,-8.4192365,False,https://www.idealista.com/inmueble/98354863/,2574,"De particular a particular. Sin comisiones. Llámanos y visita esta vivienda. Amplio piso de 120 m² en Coruña (A). La vivienda, por espacio y distribución, es ideal para una familia con hijos.  Se encuentra en planta baja con ascensor y se distribuye en salón, cocina amueblada, totalmente independiente del resto de estancias y equipada con electrodomésticos, cuatro habitaciones, cuarto de baño completo y funcional aseo. Además, el piso cuenta con balcón que aporta espectacular luminosidad a toda la estancia, terraza, para que disfrutes del buen tiempo, un patio para que puedas desayunar al aire libre, una práctica galería para aumentar el espacio. El inmueble es todo exterior. También dispone de trastero para que puedas guardar todo aquello que necesites. Este piso, situado en una vía de fácil acceso. La vivienda se vende sin amueblar y en buen estado, lista para comenzar la mudanza. En cuanto a las calidades, este piso cuenta con carpintería exterior de aluminio. Esta casa está situada en una zona bien comunicada y céntrica, muy cerca de la parada de autobús. Para mayor comodidad, la vivienda se encuentra muy cerca de un centro médico, de un colegio y de todos los servicios necesarios. h1o3u1s4e4l2l.",False,good,False,True,1125.0,True,False,False,False,False,False,flat,"Sagrada Familia, A Coruña",Piso en Ronda de Outeiro,,,,,,,
19,99209052,https://img3.idealista.com/blur/WEB_LISTING/0/id.pro.es.image.master/c6/92/50/1036718229.jpg,23356497,36,6,128000.0,flat,sale,71.0,False,3,1,Calle Alcalde Marchesi,A Coruña,A Coruña,Cuatro Caminos - Plaza de la Cubela,es,43.3551165,-8.4032527,False,https://www.idealista.com/inmueble/99209052/,2496,"Inmoarch pone a la venta una vivienda de 61m2 útiles en la peatonalizada calle Alcalde Marchesi. Una de las calles más céntricas y transitadas de A Coruña, a un minuto de la estación de autobuses, El Corte Inglés, Fábrica de Tabacos, siendo una de las zonas con mayor movimiento, dinamismo y mejor comunicada de la ciudad. Un piso interior que por su altura recibe abundante luz natural. Se distribuye en un amplio dormitorio principal, un espacioso salón, dos dormitorios interiores, cocina independiente y un baño con plato de ducha.  Se ha reformado recientemente con carpintería exterior de PVC con climalit y suelos de tarima excepto en cocina y baño que son cerámicos.  En InmoARCH prestamos un servicio integral de asesoramiento inmobiliario y arquitectónico, contando con estudio propio de arquitectura. Encuentra más en www inmoarch com.",True,good,False,True,1803.0,True,True,False,False,False,False,flat,"Cuatro Caminos - Plaza de la Cubela, A Coruña",Piso en Calle Alcalde Marchesi,,,,,,,
20,97909378,https://img3.idealista.com/blur/WEB_LISTING/0/id.pro.es.image.master/29/f6/b0/994665733.jpg,,23,3,170000.0,flat,sale,55.0,True,1,1,"Calle Real, 51",A Coruña,A Coruña,Ciudad Vieja - Centro,es,43.369673,-8.4004979,True,https://www.idealista.com/inmueble/97909378/,862,"Rentaloo vende este fantástico apartamento situado en la Calle Real, el corazón de la ciudad de A Coruña, junto al Obelisco y con todos los servicios y comodidades a un paso. Es una tercera planta sin ascensor y los 55 metros cuadrados de la vivienda se distribuyen de la siguiente manera: Se accede por el pasillo en cuyo lateral se sitúa una pequeña cocina equipada con vitrocerámica y campana extractora, nevera y fregadero. El salón de más de 20 metros cuadrados es muy luminoso gracias a la espectacular galería. Los suelos son de pinotea y están en perfecto estado. También destacan los techos altos que dan una gran sensación de amplitud y sosiego. El dormitorio es una habitación italiana con puerta corredera, armarios empotrados y baño en suite. El baño está equipado con plato de ducha con ducha hidromasaje, y una zona de lavandería. Licencia de vivienda de uso turístico. Ideal como primera vivienda o inversión. Puede recorrer el tour virtual para ver la vivienda con mayor detalle. Para más información o solicitar una visita, no dude en contactarnos.",True,good,False,False,3091.0,True,True,False,False,False,False,flat,"Ciudad Vieja - Centro, A Coruña","Piso en Calle Real, 51","[{'name': 'apartamentoType', 'text': 'Apartamento'}]",,,,,,
21,99202876,https://img3.idealista.com/blur/WEB_LISTING/0/id.pro.es.image.master/aa/27/0f/1036504397.jpg,23045,26,6,128000.0,flat,sale,77.0,False,3,1,Alcalde Marchesi,A Coruña,A Coruña,Cuatro Caminos - Plaza de la Cubela,es,43.3561165,-8.4024527,False,https://www.idealista.com/inmueble/99202876/,2376,"Elige la mejor ubicación y un sinfín de posibilidades con este piso en Cuatro Caminos. Una vivienda de 70 metros situada en la recientemente peatonalizada Alcalde Marchesi. Una de las calles más céntricas y transitadas de A Coruña. Vivirás a pocos metros de Cuatro Caminos y El Corte Inglés, con todos los servicios a la puerta de tu casa. Un piso interior que, además de tranquilidad, al ser una vivienda alta, te da abundante luz natural. Hace unos años se cambió su distribución original para ampliar la cocina y el baño e instalar dos estancias interiores a modo de dormitorios. Ahora mismo el piso dispone de un dormitorio principal muy grande y un espacioso salón con muchos ventanales, ambos con vistas a uno de los patios, y una cocina enorme y un baño con ventanas hacia un segundo patio de luces. En esta vivienda no vas a tener problemas para tender la colada al aire libre. Un piso del año 1969 al que se le han hecho ya varias mejoras. Durante la reforma se cambiaron todas las ventanas por nuevas de pvc con climalit, se instalaron suelos laminados y un amplio plato de ducha en el baño. Un piso que puedes modernizar fácilmente tirando un par de tabiques para hacer un salón abierto a la cocina, dos grandes dormitorios, más un trastero o vestidor. Si quieres más ideas llámanos o mándanos un WhatsApp al 981 170 809 para ampliar información o concertar una visita. En AGH te ayudamos a encontrar tu hogar.",True,good,False,True,1662.0,True,False,False,False,False,False,flat,"Cuatro Caminos - Plaza de la Cubela, A Coruña",Piso en Alcalde Marchesi,,,,,,,
22,98124883,https://img3.idealista.com/blur/WEB_LISTING/0/id.pro.es.image.master/14/7b/c2/1001866321.jpg,IF 112,22,2,169000.0,flat,sale,86.0,True,3,2,Calle Posse,A Coruña,A Coruña,Cuatro Caminos - Plaza de la Cubela,es,43.3550092,-8.3989406,False,https://www.idealista.com/inmueble/98124883/,2478,"A escasos metros del Parque Europa, del Corte Inglés y centro comercial Cuatro Caminos, presentamos este inmueble EXTERIOR y con ASCENSOR. Distribuido en TRES dormitorios, amplio salón comedor, cocina, cuarto de baño y aseo (podría transformarse en baño fácilmente)    Situado en Cuatro Caminos, sin duda una de las zonas más de moda de la ciudad, una zona llana, comercial, con todos los servicios, repleta de zonas verdes y parques infantiles (Parque Europa, Fábrica de Tabacos).    Ven a ver este inmueble que te está esperando para convertirse en tu hogar. Para más información o para concertar una cita, atendemos en nuestra oficina, ubicada en A Coruña, en la calle Pastor Díaz, número 24, a través del teléfono 981,91, 86,85 o a través de WhatsApp en el 654,506, 408.",True,good,False,True,1965.0,True,False,False,False,False,False,flat,"Cuatro Caminos - Plaza de la Cubela, A Coruña",Piso en Calle Posse,,,,,,,
23,95816949,https://img3.idealista.com/blur/WEB_LISTING/0/id.pro.es.image.master/cb/46/81/999344753.jpg,Zona Corte Inglés,37,7,195000.0,flat,sale,101.0,True,3,2,Calle Benito Blanco Rajoy,A Coruña,A Coruña,Cuatro Caminos - Plaza de la Cubela,es,43.3539875,-8.4030274,False,https://www.idealista.com/inmueble/95816949/,2617,"En pleno centro de Cuatro Caminos, justo la lado del Corte Inglés, disfrutarás de todas las comodidades y servicios de una de las mejores zonas de la ciudad.    La vivienda es exterior y soleada, gracias a que está ubicada en una planta alta y cuenta con orientación Sur. Todo esto hace que entre sus principales atributos destaquemos, sin lugar a dudas, las muchas horas de SOL, LUZ NATURAL y gran LUMINOSIDAD de la que disfruta esta vivienda    Nada más acceder, nos encontramos con un hall que nos lleva a la cocina y al salón comedor. La cocina es independiente y está amueblada y equipada con electrodomésticos. El salón-comedor es amplio y luminoso para poder acomodar ambos usos, tanto el de televisión y descanso, como el de comida con la familia y amigos. Finalmente, encontramos los 3 dormitorios dobles. El principal es exterior con vistas sobre la avenida Ramón y Cajal y el Corte Inglés. Posee un amplio cuarto de baño y un aseo.    Durante los últimos años se le han hecho algunas reformas, que incluyen actualizaciones en la cocina, baño, cambio de puertas y ventanas. Entre los trabajos más recientes están los cambios de suelo en las habitaciones.     Para más información o para concertar una cita, le atendemos en nuestra oficina, ubicada en la Calle Pastor Díaz, número 24, a través del teléfono 981,91, 86,85 o a través de WhatsApp en el 654,506, 408.",True,good,False,True,1931.0,True,False,False,False,False,False,flat,"Cuatro Caminos - Plaza de la Cubela, A Coruña",Piso en Calle Benito Blanco Rajoy,,,,,,,
24,98615545,https://img3.idealista.com/blur/WEB_LISTING/0/id.pro.es.image.master/34/ca/2f/1018146690.jpg,,25,2,185000.0,flat,sale,72.0,True,3,1,Calle de Sol,A Coruña,A Coruña,Monte Alto - Zalaeta - Atocha,es,43.3732744,-8.4005285,False,https://www.idealista.com/inmueble/98615545/,476,RENTALOO vende en exclusiva este precioso piso a menos de un minuto de la playa de Orzan y Matadero. La vivienda muy luminosa y exterior tiene vistas a la bahía de Riazor desde casi todas las ventanas haciéndola súper acogedora y decorada con muy buen gusto lo que convierte esta vivienda en una oportunidad única en la zona. Cuenta con varios dormitorios y un salón amplio además de cocina totalmente amueblada con armarios a medida y electrodomésticos premium. El inmueble se encuentra en un segundo piso y por el momento no dispone de ascensor. Para acercar más información o para agendar una visita presencial no dude en contactar con Rentaloo. La vivienda dispone de la tecnología virtual para visitar el inmueble pinchando sobre el icono 3D de la miniatura en foto del anuncio.,True,good,False,False,2569.0,True,True,False,False,False,False,flat,"Monte Alto - Zalaeta - Atocha, A Coruña",Piso en Calle de Sol,,,,,,,
25,97253167,https://img3.idealista.com/blur/WEB_LISTING/0/id.pro.es.image.master/e7/09/23/999787435.jpg,259551,23,1,135000.0,flat,sale,69.0,False,3,1,Cuatro Caminos - Plaza de la Cubela,A Coruña,A Coruña,Cuatro Caminos - Plaza de la Cubela,es,43.3546342,-8.4001898,False,https://www.idealista.com/inmueble/97253167/,2523,"Buena oportunidad piso de 3 habitaciones, salon, un baño y cocina. Necesita reforma, excelente ubicación, adaptado a minusválidos. Está a escasos metros de la zona del Paseo marítimo del Puerto de La Coruña, tabacalera, y la calle Ramón y Cajal cuatro caminos centro comercial, y Corte Inglés. Barrio consolidado y familiar. Excelentes comunicaciones. Excelente oportunidad para adquirir una vivienda como inversión para alquilar, o vivienda habitual. Consúltenos condiciones y rentabilidad, ( El PVP indicado no incluye impuestos ni gastos de Escritura ).  PARA PROPIETARIOS:  ¿Necesitas vender para comprar? te ayudamos coordinándolo todo y con hipoteca cambio de casa. ¿Tienes prisa en vender? te ofrecemos una venta rápida con todas las garantías. ¿Necesitas una hipoteca? en donpiso la encuentras y en condiciones preferentes. ¿Herencias? , ¿Divorcios? , te ayudamos y coordinamos todo. Infórmate: 628 739 726 -.",False,renew,False,True,1957.0,False,False,False,False,False,False,flat,"Cuatro Caminos - Plaza de la Cubela, A Coruña",Piso,,,,,,,
